{
  "trades": [
    {
      "date": "2026-03-25",
      "time": "13:51:44",
      "type": "buy",
      "price": 27.62,
      "quantity": 100,
      "fee": 5.0,
      "note": "ๆญๆฐง่กไปฝ",
      "idempotent_key": "2026-03-25_13:51:44_27.620_100_buy",
      "id": "t_09147074"
    },
    {
      "date": "2026-03-30",
      "time": "14:54:53",
      "type": "buy",
      "price": 28.92,
      "quantity": 100,
      "fee": 5.0,
      "note": "ๆญๆฐง่กไปฝ",
      "idempotent_key": "2026-03-30_14:54:53_28.920_100_buy",
      "id": "t_24a7b965"
    }
  ],
  "t_trades": [],
  "adj_events": [],
  "summary": {
    "total_quantity": 200,
    "avg_cost": 28.27,
    "total_cost": 5654.0,
    "realized_pnl": 0.0,
    "open_short": 0,
    "last_trade": {
      "date": "2026-03-30",
      "time": "14:54:53",
      "type": "buy",
      "price": 28.92,
      "quantity": 100
    }
  }
}