{
  "trades": [
    {
      "date": "2026-07-01",
      "time": "10:35:51",
      "type": "buy",
      "price": 54.71,
      "quantity": 47,
      "fee": 5.0,
      "note": "",
      "idempotent_key": "2026-07-01_10:35:51_54.710_47_buy",
      "id": "t_736bba4d"
    },
    {
      "date": "2026-07-03",
      "time": "09:36:04",
      "type": "sell",
      "price": 58.26,
      "quantity": 47,
      "fee": 5.0,
      "note": "",
      "idempotent_key": "2026-07-03_09:36:04_58.260_47_sell",
      "id": "t_37ecc7db"
    }
  ],
  "adj_events": [],
  "summary": {
    "total_quantity": 0,
    "avg_cost": 0,
    "total_cost": 0.0,
    "realized_pnl": 166.85,
    "open_short": 0,
    "last_trade": {
      "date": "2026-07-03",
      "time": "09:36:04",
      "type": "sell",
      "price": 58.26,
      "quantity": 47
    },
    "last_buy_price": 54.71,
    "last_sell_price": 58.26
  },
  "t_trades": [
    {
      "id": "tt_f7157bea",
      "type": "正T(跨天)",
      "buy_date": "2026-07-01",
      "buy_time": "10:35:51",
      "buy_price": 54.71,
      "sell_date": "2026-07-03",
      "sell_time": "09:36:04",
      "sell_price": 58.26,
      "quantity": 47,
      "profit": 166.85,
      "buy_trade_id": "t_736bba4d",
      "sell_trade_id": "t_37ecc7db"
    }
  ]
}