{
  "trades": [
    {
      "date": "2025-08-19",
      "time": "09:30:00",
      "type": "buy",
      "price": 25.63,
      "quantity": 100,
      "fee": 5,
      "note": "",
      "idempotent_key": "2025-08-19_09:30:00_25.630_1000_buy",
      "id": "t_931ecd62"
    },
    {
      "date": "2026-01-13",
      "time": "14:15:07",
      "type": "sell",
      "price": 39.21,
      "quantity": 100,
      "fee": 5.0,
      "note": "",
      "idempotent_key": "2026-01-13_14:15:07_39.210_100_sell",
      "id": "t_2eaf214c"
    }
  ],
  "adj_events": [],
  "summary": {
    "total_quantity": 0,
    "avg_cost": 0,
    "total_cost": 0.0,
    "realized_pnl": 1358.0,
    "open_short": 0,
    "last_trade": {
      "date": "2026-01-13",
      "time": "14:15:07",
      "type": "sell",
      "price": 39.21,
      "quantity": 100
    },
    "last_buy_price": 25.63,
    "last_sell_price": 39.21
  },
  "t_trades": [
    {
      "id": "tt_a3bcb8a8",
      "type": "正T(跨天)",
      "buy_date": "2025-08-19",
      "buy_time": "09:30:00",
      "buy_price": 25.63,
      "sell_date": "2026-01-13",
      "sell_time": "14:15:07",
      "sell_price": 39.21,
      "quantity": 100,
      "profit": 1358.0,
      "buy_trade_id": "t_931ecd62",
      "sell_trade_id": "t_2eaf214c"
    }
  ]
}